{
  "action": {
    "agent": "verification_exec",
    "inputs": {
      "attempt_index": 2,
      "budget_remaining": 0,
      "issue_class": "vacuous_property",
      "issue_detail": "property is vacuously true",
      "prior_artifact_path": "<BASE_DIR>/work/SnapTest-Rule/step06_verification_gate.json",
      "rule_id": "SnapTest-Rule"
    },
    "step": "step06_verification_gate",
    "type": "refine_step"
  },
  "current_state": "synthesized",
  "missing_artifacts": [
    "step06_verification_gate.json"
  ],
  "next_state": "verified",
  "reason_code": "vacuous_property",
  "required_artifacts": [
    "step06_verification_gate.json"
  ],
  "status": "ok"
}